{
  "schema_version": "2.3",
  "manifest_revision_id": "efm_01J00000000000000000000016",
  "manifest_kind": "workflow_time_import_export",
  "project_id": "efp_01J00000000000000000000001",
  "tree_revision_id": "eft_01J00000000000000000000005",
  "workflow_occurrence_id": "efw_01J00000000000000000000014",
  "readable_locator": ".expflow/projections/workflows/example/WORKFLOW_TIME_IMPORT_EXPORT.md",
  "content_digest": "sha256:eeeeeeeeeeeeeeeeeeeeeeeeeeeeeeeeeeeeeeeeeeeeeeeeeeeeeeeeeeeeeeee",
  "status": "accepted",
  "projector_class": "model_assisted",
  "projector_name": "workflow-manifest-projector",
  "projector_version": "2.2",
  "model": "configured-model",
  "prompt_digest": "sha256:ffffffffffffffffffffffffffffffffffffffffffffffffffffffffffffffff",
  "source_refs": [
    "efw_01J00000000000000000000014",
    "efa_01J00000000000000000000011"
  ],
  "source_decision_refs": [
    "efsd_01J00000000000000000000012"
  ],
  "accepted_by": {
    "kind": "user",
    "name": "project-owner",
    "version": null,
    "model": null
  },
  "accepted_at": "2026-07-15T12:15:00Z",
  "superseded_by": null,
  "stale_reason": null,
  "created_at": "2026-07-15T12:14:00Z"
}
